{
  "schema_version": 1,
  "profile": "positive-facts-v1",
  "expected_type": {
    "kind": "Arrow",
    "from": {
      "kind": "Entity"
    },
    "to": {
      "kind": "Prop"
    }
  },
  "ports": [
    {
      "id": "x",
      "type": {
        "kind": "Entity"
      },
      "binding": {
        "kind": "Ref",
        "id": "A",
        "type": {
          "kind": "Entity"
        }
      }
    },
    {
      "id": "y",
      "type": {
        "kind": "Entity"
      }
    }
  ],
  "references": [
    {
      "id": "A",
      "type": {
        "kind": "Entity"
      }
    }
  ],
  "allowed_operators": [
    "relation",
    "join",
    "restrict",
    "bind",
    "permute"
  ],
  "constraints": [
    {
      "id": "path01",
      "kind": "path",
      "symbol": "r",
      "from_port": "x",
      "to_port": "y",
      "from_role": "a",
      "to_role": "b",
      "allowed_atom_counts": [
        2
      ]
    },
    {
      "id": "property01",
      "kind": "unary",
      "symbol": "p",
      "port": "y"
    }
  ],
  "provenance": [
    {
      "id": "dse386-neutral-goal",
      "uri": "https://github.com/clickbytes/golingua/issues/386",
      "version": "2026-10-26.1",
      "license": "internal-neutral-example",
      "author": "Codex by owner delegation"
    }
  ],
  "limits": {},
  "context_id": ""
}
